,content,userName,reviewId,title,appId,score_x,thumbsUpCount,dominant_topic,dominant_topic_meaning,developer,genre,contentRating,containsAds
15312,"A good game ruined! I joined this game in the early days and it was different and fun and from the creators of Diggy's Adventure. I put money into it to support it. Soon after, they changed it into a cash cow. Events can't be completed unless you spend money, block values are ridiculously high and energy regen is slow. You get the occasional challenging puzzle, but it's mostly clearing blocks and just plain boring! I have decided, reluctantly, to uninstall because it just isn't fun anymore.",Derek,5ee2261e-ffef-4589-be05-aaa86c3c1c6e,Puzzle Adventure: Mystery Tale,com.pixelfederation.solve.mystery.puzzle.adventure,1,123,3,Graphics & Gameplay,Pixel Federation Games,Adventure,Everyone 10+,True
15417,"Very basic little puzzle game. Kinda fun. Low rating is due to the way in which they implemented the energy system. Less than 20 minutes into game only on second mission, and you run out of energy for first time. Personally, I hate energy systems, but I understand ya can't get away from em on phone games. However, if you want your players to stick around and play, ya have to build it so that it takes a couple hours til the player actually has to wait for the energy refill for the first time.",Brock,5361e2da-0509-42c0-8d09-e76dcc5a37f9,Puzzle Adventure: Mystery Tale,com.pixelfederation.solve.mystery.puzzle.adventure,2,105,3,Graphics & Gameplay,Pixel Federation Games,Adventure,Everyone 10+,True
15931,"I really enjoy this game, EXCEPT! The puzzles (Mosaic, Haunted Lights, Treasure Box, Ancient Cards) are absurdly difficult for the time limit allowed, the talismans don't help enough. The town search locations are already timed, & you have to get other items for collections too, can we look at taking the timer off the puzzles, please? I don't like having to use 8-10 booster$ to get through 1 puzzle, then have to repeat the puzzle 2-3 times more (more booster$) because I don’t get what I need.",Karen Seebeck-Keeler,b3883f05-f5b3-43b0-8388-22ee7b5a30a8,Seekers Notes: Hidden Objects,com.mytona.seekersnotes.android,4,106,3,Graphics & Gameplay,Mytona,Adventure,Everyone,True
16090,"Used to love this game but changes made by the developer have turned this into a cash cow. There is an overload of in-app offers. Rewards for completing daily/event tasks are essentially useless. Takes too long to build up access passes for completing the event but they're very happy if you buy them. Games should be balanced between player and developer, this one definitely is NOT.",Virginia Russell,04790826-06a9-4576-871d-d44128786df5,Seekers Notes: Hidden Objects,com.mytona.seekersnotes.android,1,183,3,Graphics & Gameplay,Mytona,Adventure,Everyone,True
16115,I mostly love this game! Sometimes it does seem like there's too much going on but that's okay. I wish there was not the Mosaic puzzle that was part of this because those are way too hard. I've seen a few reviews mentioned ads but I've never had ANY ads! My only issue is it's very difficult getting the fixers needed (IE the pink and white feather and candlestick) to assemble the collection,K OConnor,48886d64-1db3-418c-bfb7-046e4fdfc320,Seekers Notes: Hidden Objects,com.mytona.seekersnotes.android,5,241,3,Graphics & Gameplay,Mytona,Adventure,Everyone,True
16129,"The game is entertaining and fun to start, but quickly becomes far too difficult. This is planned. You will fail levels again and again, and you will not progress further without spending money to add search time. So this is a fail in my opinion. Hidden object games should be relaxing, not stressful. I am uninstalling and will look for a better experience elsewhere.",Jarrod Patton,da3addac-f37d-4e9e-969d-d5c0742e263d,Seekers Notes: Hidden Objects,com.mytona.seekersnotes.android,1,101,3,Graphics & Gameplay,Mytona,Adventure,Everyone,True
16166,"This game has improved over the years and is great. I quit playing this for 5 years. I've played all other games like this and have come back to because it is the best. They have a lot of side games , many with no energy used. This keeps things interesting. There are no ADS unless you want to earn something extra. They are generous with collection items and fixers to complete collections. One game I played, I had 21 collections I couldn't complete without buying something.",C Guer,e1bc2e63-1bb3-471e-84e5-4ea579af6509,Seekers Notes: Hidden Objects,com.mytona.seekersnotes.android,5,113,3,Graphics & Gameplay,Mytona,Adventure,Everyone,True
16180,"I love the game, have been playing for a very long time. I think more tools should be given as prizes for completing the side games though. The new Darkwood Quests is not good, some of the rewards are unobtainable as the quests are ridiculous. I'd rather have the old style back.i also think some of the ads are far too long to play for double points etc.",Sharon whatever,da2b2f64-1ef6-4a89-b278-005a3a0bc91a,Seekers Notes: Hidden Objects,com.mytona.seekersnotes.android,5,102,3,Graphics & Gameplay,Mytona,Adventure,Everyone,True
16186,"You have changed the game . Did not give us, the players anyway to get ahead. made it much harder to play unless you are rich.have made my last purchase of rubies you really need to fix this. I have been playing for a long time and spent a lot of money..I really love this game.give back the fun. I cannot afford you..Sandy and GIGI. Your answer to me is insulting. I know how to play this game,been playing for years. Helped me through my depression..Now you are taking away all the joy and fun.",sandra Freeland,96606970-e950-46e8-83df-5e3833d2a969,Seekers Notes: Hidden Objects,com.mytona.seekersnotes.android,4,372,3,Graphics & Gameplay,Mytona,Adventure,Everyone,True
16209,not only are there excessive ads but I find it extremely irritating (especially with the short timer ones) when the game decides it doesn't want to respond with one tap on an item and I have to tap several times on an item before it finally takes it sometimes even showing an x right over the item that needs to be taken! then suddenly they take away more time for tapping too many times before the item finally is taken out!just watched an ad for this game that said NO ANNOYING ADS! What a lie!!!,Tiara Rowburn,764eaa92-e3c2-4bba-ac32-d11aebe0c36b,Seekers Notes: Hidden Objects,com.mytona.seekersnotes.android,1,163,3,Graphics & Gameplay,Mytona,Adventure,Everyone,True
16242,"The game has gotten less rewarding and fun over the last few years. It used to be so much fun to complete quests & feel excited that you won/earned something! Now it's just so depressing when you play so hard & even spend $ and they continue to take away the ways to earn rewards & send gifts. They have lost many long time players, the newbies don't know any better of when it was more rewarding. Gone is the beautiful Vintage charm. New locations are cartoonish and bright.It's more like Brightwood",Gina Maloney,494e134a-f92b-4323-a592-4e307eca1dc4,Seekers Notes: Hidden Objects,com.mytona.seekersnotes.android,2,175,3,Graphics & Gameplay,Mytona,Adventure,Everyone,True
16266,"The graphics are stunning and the artwork of this game is spectacular. I just wish we got more free stickers, and better winnings when we complete a collection. And the haunted lights are so hard. Loveeeee the new update March 2024 omg it's stunning. Like Alice in wonderland or something. Still feel like we should will better gifts for completing collections, winning in our guild , etc. Please",Nikie Nu,0f934030-d382-4085-915c-8aa172fdea12,Seekers Notes: Hidden Objects,com.mytona.seekersnotes.android,5,176,3,Graphics & Gameplay,Mytona,Adventure,Everyone,True
16363,"I enjoy the game and I've been playing for quite some time now. I'm not sure why the ads are no longer muted when the game sounds are. They (the ads) are also a LOT louder than the game sounds when I have those on. This limits where and when I can play, and totally negates the relax effect. It would also be nice to have a pay option that removes ads completely, not just for a time frame.",Rochelle Marshall,937dad2e-a3c0-4735-b9f0-55b201ec7b41,Seekers Notes: Hidden Objects,com.mytona.seekersnotes.android,3,109,3,Graphics & Gameplay,Mytona,Adventure,Everyone,True
16444,"I enjoy the game, think it helps with memory. That being said, there are way too many ads and discrepancies in the amounts that are charged to different people for the same items. They have reduced the prizes and chest items, and made it harder to complete darkwood stories by reducing the number of puzzle pieces for trade, and the number of duplicates that you get with the cards is astronomical. Last month I had well over 3000 points for duplicates.",G Kanegae,ea275187-1085-4050-9d9b-950fc3c70b02,Seekers Notes: Hidden Objects,com.mytona.seekersnotes.android,3,119,3,Graphics & Gameplay,Mytona,Adventure,Everyone,True
16557,"The game has excellent graphics and storytelling. As much as I would love to give it 5 stars, my biggest issue is that while you're on the map and between missions, the offer pop-ups are excessive to the point of spam. I'm finding myself declining the same two offers back to back within 5 seconds of each other, and by the time it offers an ad to watch, I'm aggravated and no longer want to play. Reduce the frequency and repetition of the in-app offers, and I'll increase my rating.",Latoya B.,ea780c24-f349-4e9f-bbf3-acbb679f3a34,Seekers Notes: Hidden Objects,com.mytona.seekersnotes.android,3,139,3,Graphics & Gameplay,Mytona,Adventure,Everyone,True
16612,"It was a 5 stars until they changed the Guild Events.. what a waste of a Great Game... second one in as many months to ""improve"" their platforms only to RUIN THE GAME!... UPDATE... THE GUILD EVENTS HAVE RETURNED TO THEIR ORIGINAL FORMAT SO THANK YOU THANK YOU! BUT.. I have had several instances when I'm trying to clear a board that the item I can't find IS NOT EVEN in the picture. I HAVE TAKEN SEVERAL SCREEN SHOTS and even after blowing up the scene none of us could find the missing items!",Noriene Jones,62b6a75c-8efe-4308-bb00-e2c177cf16b1,Seekers Notes: Hidden Objects,com.mytona.seekersnotes.android,3,108,3,Graphics & Gameplay,Mytona,Adventure,Everyone,True
16649,"This game could be super fun, but there are so many annoying things that make it unplayable and stressful. First, there are offers every second trying to get you to spend $ on items I have no clue what they're for. Hitting the x does nothing bc it pops up again and again. 2nd, the storyline is confusing. Too many things going on at once. Just let me play the game please! The scenes themselves are a bit tricky, esp as objects move around and I HATE the timer. Sadly, I think I'll be deleting this",Kayla Salmon,d93f5e68-e77b-4bb1-827b-6ab23dc69e92,Seekers Notes: Hidden Objects,com.mytona.seekersnotes.android,2,113,3,Graphics & Gameplay,Mytona,Adventure,Everyone,True
17051,"Loved the game, until I couldn't play it. Had played this a few months prior and it worked perfectly fine. Now when I install the game and try to sign in, it always says offline, please try again later. It's been 2 days I've tried to sign in through my account and the same issue. I have perfectly working wifi connection with 100+ megabits per second speed both of download and upload. Please fix this. When I'm back in the game being able to play, I'd rate it 5 stars.",Ishan Monga,801ae603-fb9d-4369-9bf5-5e3310305f62,Among Us,com.innersloth.spacemafia,1,120,2,Issues Concerns,Innersloth LLC,Action,Everyone 10+,True
17077,"I don't know what happened to the game. The game is pretty much unplayable. The game will indeed crash and kick you out multiple times. Every time I play there is at least 2 to 5 games that will have hackers and ruin the game. When the game first came out I was able to play it just fine. But now, with the new updates and items it's beyond unplayable. I would have given this game a zero.",Ventus Gonzo,adbd3fb9-cc01-4542-b459-421094151f70,Among Us,com.innersloth.spacemafia,1,406,2,Issues Concerns,Innersloth LLC,Action,Everyone 10+,True
17142,"This game is amazing and to people who are complaining about bugs I get it. Ive only seen three bugs and its that sometimes (So far 4 times) I am kicked out when an online game, a lot my screen will be fixed to the bottom and only my character moves (this is VERY wierd), and I drop 6 pings which I dont think is a glitch and Is just my wifi. Anyways I loooove this game. 😄 Another bug is that in a meeting the time runs out to vote but it doesnt end and even when imposter leaves it STILL wont end.",Joseph,663ac75e-e786-43ac-9797-c00b76ff8026,Among Us,com.innersloth.spacemafia,5,266,2,Issues Concerns,Innersloth LLC,Action,Everyone 10+,True
17170,Always had issues with this game since it became big and started getting major updates. First I had connectivity issues - where you'll get kicked out automatically. Now I can't even sign in - I get an error.,Crispin K.,59c00ea0-e9a3-45b7-b9af-16dd97a9c6a4,Among Us,com.innersloth.spacemafia,1,170,2,Issues Concerns,Innersloth LLC,Action,Everyone 10+,True
17241,"Among Us is an incredible game that's perfect for playing with friends. The gameplay is simple yet strategic, and the graphics are amazing. I love the updates and new features! I was skeptical at first, but Among Us quickly became my favorite mobile game. The community is great, and the game is so much fun to play. 10/10 would recommend! This game is a masterclass in social deduction. It's challenging, entertaining, and always keeps me on my toes. Great job, developers!",Rushi Vyas,c310b6b5-c6ab-4151-9528-67d3b4521821,Among Us,com.innersloth.spacemafia,5,596,1,Praise and Comparisons,Innersloth LLC,Action,Everyone 10+,True
17279,"I CANNOT LOGIN! When I put my credentials in, it says it found a new player, not my actual profile name! So when I accept okay, it just sits there and loads! I had it sit there and loading for 5 minutes! *I lost all my progress. And I can't log in with my credentials! Not sure what's going on but I don't think this is syncing up with Google Play Games! My progress is still stored there but it's not letting me use them! I've been playing this game for years, so if you can't help fix it, I'm done!",Brian Lee Daniels (Bleed),be0c279b-bed0-478d-ab61-c435e409a6e4,Mortal Kombat,com.wb.goog.mkx,2,201,2,Issues Concerns,Warner Bros. International Enterprises,Action,Mature 17+,True
17311,"This application doesn't allow you to retrieve lost accounts, if the app is uninstalled, say goodbye to all your progress, even when your email and password are very functional it will send you to a deadlock🔏 loading screen☠️. The development so far showcasese poor initiative. Every time I download the application I have to uninstall it for a long time because I can't get my account loaded up in the app, which makes the whole process of using the app a nerve racking stress. Soo disappointing🤬.",Marvel Enyindah,1de93fa6-d3c7-4048-931b-ba8de77c8287,Mortal Kombat,com.wb.goog.mkx,1,374,2,Issues Concerns,Warner Bros. International Enterprises,Action,Mature 17+,True
17313,"Mortal Kombat Mobile delivers an intense and visually stunning experience, perfectly capturing the brutal action of the main franchise. The diverse roster of iconic characters, coupled with smooth gameplay and spectacular Fatalities, makes it a must-play for fans of fighting games. The constant updates and events keep the content fresh, while the challenge modes offer great rewards.Community feedback is actively considered, and the developers often address bugs and balance issues with patches.",Lateef Saheed,30a08fbd-c7fd-4e74-a1c1-98239904912d,Mortal Kombat,com.wb.goog.mkx,5,764,3,Graphics & Gameplay,Warner Bros. International Enterprises,Action,Mature 17+,True
17331,"absolutely every ""Survival"" throws the game out for me and my team ends the campaign at the beginning/middle stages. This is very terrible for beginners (like me) who have only 1-2 teams to play this mode. In other words, the Survival mode for a beginner becomes impossible due to constant crashes! And this is a very important mode at the beginning-middle stages of growing! I will gladly give 5 stars if you fix this. Upd: i started play FW when mobile is cold only and the issue disappeared",Serhii Chaikovskyi,aab80293-911b-4403-9f05-9055606c681e,Mortal Kombat,com.wb.goog.mkx,5,314,3,Graphics & Gameplay,Warner Bros. International Enterprises,Action,Mature 17+,True
17346,The offered rewards for almost three weeks unable to play are not covering even 5% of our losses. But at least after between two and three weeks we are finally and once more able to play this game even if it still is full of errors and bugs. Thank you Mk Mobile not for carrying about us but for making the game once more playable by everyone.,RRT Official,6a1e2d44-8b95-4fe8-bcd7-d49c110ad691,Mortal Kombat,com.wb.goog.mkx,5,1664,2,Issues Concerns,Warner Bros. International Enterprises,Action,Mature 17+,True
17362,your dumb app isn't working. 0 stars,Arsen Tovmasyan,b5c85e48-8b31-4f2e-a38a-e8c8e60d8183,Mortal Kombat,com.wb.goog.mkx,1,211,2,Issues Concerns,Warner Bros. International Enterprises,Action,Mature 17+,True
17370,"Back to loving it, kameos are difficult at first, but are a fun addition",Glenn Lloyd,ca834d2f-6d58-4697-b9db-bc3936284501,Mortal Kombat,com.wb.goog.mkx,5,633,3,Graphics & Gameplay,Warner Bros. International Enterprises,Action,Mature 17+,True
17383,"Love the look and fluidity of the fighters and it's always a great game to play. March update has an issue where you get enough Reptile eyes to open the Klassic Reptile challenge, but it will not allow me to battle him. July update, still cannot earn Reptile eyes or fight him. Please fix. October update was working great, suddenly the game will not open. It goes through the title screen then to the main screen. It trys to load, then it simply stops.",Michael Stout,c5f6dd05-7baa-43b3-aac3-461afb653fe7,Mortal Kombat,com.wb.goog.mkx,3,1278,2,Issues Concerns,Warner Bros. International Enterprises,Action,Mature 17+,True
17416,"I love the new update and the QOL improvements so far. However, there's one small issue i noticed and it's the kameo's xp gain post-battle. The game just pause for two seconds before letting us press continue. It's obviously not a big deal but having to go through this pause after every match tend to get frustrating.",Ahmed Alboshaka,db352378-da38-4f3d-99de-5f2de8ceb6fd,Mortal Kombat,com.wb.goog.mkx,5,354,3,Graphics & Gameplay,Warner Bros. International Enterprises,Action,Mature 17+,True
17426,"Hey guys, if this makes it to anyone. Please, please, redo the online matching.....it is terrible. For example, I can only pick bronze and silver characters. Why am I going against diamond? The other side should be the same as me, enuff said. 1 stars off for the crazy unmatched online, 1 for bugs and 2 for the New Kameo system. No one asked for Kameos. I've tried to unequipping my kameo hoping the CPU would do the same for better fight but, nope.People want what MK is known for, fatalities.",Jimm Houng,258f2c04-e052-4198-8dbd-c06f688b4509,Mortal Kombat,com.wb.goog.mkx,1,498,3,Graphics & Gameplay,Warner Bros. International Enterprises,Action,Mature 17+,True
17456,UPDATE: Logged in today and all purchase errors have been fixed and I now have access to the Season 15 kombat pass I purchased. Massive update with lots more for veterans to collect and great additions for beginners as well to help them get started and progress. MK Mobile...still the best fighting game on Android!,Lonnie Lawless,c0a0da75-d8d1-4472-93d1-75e60f62b5c1,Mortal Kombat,com.wb.goog.mkx,5,191,2,Issues Concerns,Warner Bros. International Enterprises,Action,Mature 17+,True
17459,"The latest update has a lot of bugs. When I play the Krypt, if I pause the game while it's in auto-play mode and then resume playing, it crashes. Additionally, I get a lot of connection errors. Lastly, I just realized that I can't play the Survivor mode. The fight button is not enabled even when I select characters that I'm supposed to be able to select.",Samuel Romero,ddeff37c-8269-42e3-82cf-207587bb69f7,Mortal Kombat,com.wb.goog.mkx,1,421,2,Issues Concerns,Warner Bros. International Enterprises,Action,Mature 17+,True
17485,The new update won't let you open packs up. Keeps saying purchase error.. please fix,Mark Wells,c27cb9c1-f5a6-4b15-a558-bd3ce452f2ef,Mortal Kombat,com.wb.goog.mkx,2,128,2,Issues Concerns,Warner Bros. International Enterprises,Action,Mature 17+,True
17488,Hey I only got one of my kameos and the game restarted and the other card disappeared.,Rach B,cfdbc838-079d-4ef1-a433-e6dc5cfab05c,Mortal Kombat,com.wb.goog.mkx,5,105,2,Issues Concerns,Warner Bros. International Enterprises,Action,Mature 17+,True
17498,"Great game, lots of ads but quality etc. is pretty good. One thing I don't like is the deaths are unrealistic, like when someone dies kn either a building or the ground, it falls through and like glitches. But nonetheless, a good game overall.",Aidan Hanratty,dc049fed-3dd9-46a1-ae3c-f115869da8ac,Sniper 3D：Gun Shooting Games,com.fungames.sniper3d,5,410,3,Graphics & Gameplay,Wildlife Studios,Action,Mature 17+,True
17502,Great sniper game!! Love it! /THAT WAS THEN AND THIS IS NOW! Now the game is loaded with pop-ups all the time every time you get a x to x out of something of a pop-up comes on. I'm thinking about uninstalling it because of that,Darrill Wakely,cb09f2c9-a71a-4cf3-b503-1753df86f4a4,Sniper 3D：Gun Shooting Games,com.fungames.sniper3d,5,468,3,Graphics & Gameplay,Wildlife Studios,Action,Mature 17+,True
17504,"Free to play? - yes. Will you be able to top any leaderboards without paying? - no. This game is fun to play, but progress will not be fast, unless you are willing to pay $$$.",Ian West,eb70bf3a-fb57-4073-ab15-48a1c5fa7ae3,Sniper 3D：Gun Shooting Games,com.fungames.sniper3d,2,332,0,Payment and Ads,Wildlife Studios,Action,Mature 17+,True
17514,Game crashes over and over again. (5) Times during battle royal and (4) more times after that match. This is a problem I have been dealing with since 2019 why does the game crash on me on any device that I ever run. How could anyone ever competitively play when you're not even able to connect. This game could be a five-star but I'm giving it a one star because its performance problems are just so terrible.,Beau Redig,f70485e0-0012-40f0-ba03-7a4b24805d99,Call of Duty: Mobile Season 10,com.activision.callofduty.shooter,1,309,2,Issues Concerns,"Activision Publishing, Inc.",Action,Mature 17+,True
17520,"It's a love hate experience. I really enjoy it most of the time,graphics are awesome, accurately matched with same skilled people,and simple gun play. I would recommend over warzone mobile. I also love that things are cheap. I especially love the new recruitment packs in the store for only 1200 credits. It helped a lot. But if you have enough free space I definitely recommend. If you spend a lot of money,then make or log in to an Activision account and Google. Works for me.",Rex “ILoveMyMom.AndTanks” Millage,a0057549-086b-4730-8498-3291dafad03b,Call of Duty: Mobile Season 10,com.activision.callofduty.shooter,5,161,1,Praise and Comparisons,"Activision Publishing, Inc.",Action,Mature 17+,True
17526,"Hackers, cheat codes, and glitches. Sliding face first into gun fire and still surviving. People glitch in mid-air as they glide down from buildings and as well can snipe you out the helicopter from across the map. I wouldn't pay for it if it costs to download. It's just something to do when you're bored. However, always expect to play against one or a team full of hackers. With map hack, shooting hacks, speed hack and external controller hack with modified controllers.",Melvin Montgomery,f9a5b649-c4d7-447e-b134-cbac370427b1,Call of Duty: Mobile Season 10,com.activision.callofduty.shooter,1,470,0,Payment and Ads,"Activision Publishing, Inc.",Action,Mature 17+,True
17531,"There are multiple game modes, including a campaign with multiple chapters, zombie survival, and skirmish modes against other players.The game boasts impressive 3D graphics, especially on higher settings, setting a new bar for rail. The controls are intuitive, with options to use the right analog stick for aiming and touch screen. The core gameplay involves taking on various missions. This game is awesome.",Santhosh,a1f774d9-fcb6-46c8-91f9-33a159d9a507,Cover Fire: Offline Shooting,com.generagames.resistance,5,241,3,Graphics & Gameplay,Viva Games Studios,Action,Teen,True
17534,"Great graphics and superb gameplay. Does it get silly hard quick? Kinda. But, you regroup try again. Yet it doesn't get to the point you wanna punch a puppy hard . One of the most well executed action games I've found in years. Just saying.",Lucifer Smith,d9edfd89-8a78-466c-99c6-75defc2ab74c,Cover Fire: Offline Shooting,com.generagames.resistance,5,119,3,Graphics & Gameplay,Viva Games Studios,Action,Teen,True
17539,"Cooler than I initially thought . I love FPS games and this delivers a lot of fun. Plenty of characters, options and ability to go back and play previous missions. The reward system is adequate but I think it would be a lot more difficult if you didn't do in app purchases. Still, this is a fun game",Gary Murphy,bf24a7c7-545a-41bd-8d90-bd9975133f2b,Cover Fire: Offline Shooting,com.generagames.resistance,5,142,3,Graphics & Gameplay,Viva Games Studios,Action,Teen,True
