,content,userName,reviewId,title,appId,score_x,thumbsUpCount,dominant_topic,dominant_topic_meaning,developer,genre,contentRating,containsAds
7098,"Extremely both incredibly easy to utilize and explore on both your own end, but more importantly, it was ultimately exactly just as simple and clearly understood the clearly expressed, and reiterated quite well as to myself and my newly turned 3 little young son Jordan",Aubrey,309258b6-e16d-4fe9-bdc3-6b3efa36d2c5,World of Peppa Pig: Kids Games,com.peppapig.worldofpeppapig_g,5,129,3,Graphics & Gameplay,Find Your Fun,Educational,Everyone,False
7099,Great game! So much fun! My daughter loved this game but I opted not to renew our yearly subscription as my daughter doesn't play it as much anymore now that she is older. She still loves it but I can't warrant the sub cost VS the amount she plays. Wish I could easily pay to unlock the full version forever like other games.,amymzed,6c245560-30f7-4196-9ccb-10b6a2df4d89,World of Peppa Pig: Kids Games,com.peppapig.worldofpeppapig_g,5,180,1,Praise and Comparisons,Find Your Fun,Educational,Everyone,False
7115,"Problem with sound, all sound goes off after a few minutes of playing. Please fix as paying a subscription for an app thats not working.",Sarah Woods,a01ea7e6-2ee9-4dcf-9b42-e9a53740b8c0,World of Peppa Pig: Kids Games,com.peppapig.worldofpeppapig_g,1,159,2,Issues Concerns,Find Your Fun,Educational,Everyone,False
7117,"Horrible to switch between devices. I've had such issues with this app switching between my daughter's tablet and my phone. It's all the same google play account and other apps do not have this issue. I've also had so much trouble with the subscription service. It began as 6.99 a month and then switched to 2.49 a month, then 0.00 and now it wants to charge 6.99 again to subscribe. What gives?! Its so frustrating that I'm constantly kicked off the subscription because the price changes.",Cassandra Kurth,17aca728-6750-451d-aaec-e57a57e6f267,World of Peppa Pig: Kids Games,com.peppapig.worldofpeppapig_g,2,788,2,Issues Concerns,Find Your Fun,Educational,Everyone,False
7118,It's a nice app but my child grew out of the games very quickly- they're way to easy. The price they charge for one year should be enough for lifetime access. Changing the theme a couple times a year isn't a justifiable excuse to charge such an excessive amount.,Breanna,ef9cffbe-2e88-4587-9dc6-aa58cf7b6ca8,World of Peppa Pig: Kids Games,com.peppapig.worldofpeppapig_g,3,372,0,Payment and Ads,Find Your Fun,Educational,Everyone,False
7119,"My lo loves the games and he does have a monthly subscription. However there are a number of bugs that ruin his fun. For example when you minimise the app and then reopen, the sounds turns off and there's no way of turning it back on without closing and reopening the app.",Nico leta,d4e5d366-ff64-468a-ad65-335ae2b84e20,World of Peppa Pig: Kids Games,com.peppapig.worldofpeppapig_g,4,390,2,Issues Concerns,Find Your Fun,Educational,Everyone,False
7132,"Very little content. There is very little you can get for free. I honestly expected more. There are like a few things to do in play and learn, one thing in create, and like one single video, which is a teaser. I would like it better if there was more to do for free. The hamster game, the shape game, and the dress up game are like the only games, but they are fun. I don't really like the fact that you can only get a teaser in the video section. I hope this game is better in future updates. 😃",Bushra Zeb,1987f257-6cbc-4925-a824-ff84838d146f,World of Peppa Pig: Kids Games,com.peppapig.worldofpeppapig_g,2,137,3,Graphics & Gameplay,Find Your Fun,Educational,Everyone,False
7133,"This game is a waste of time and space. What's the point of it being a free download when you basically need to PAY for everything. Only 2 games are open the rest you have to download, sorry, buy! Then it's the same with videos. What a moneymaking rip-off ....",Anusha Roopram,95be88c4-2a75-4eff-88be-ecdd0728f8b2,World of Peppa Pig: Kids Games,com.peppapig.worldofpeppapig_g,1,223,0,Payment and Ads,Find Your Fun,Educational,Everyone,False
7156,"The value of the app is not matching the price! Even the yearly subscription is overpriced! They say they are updating the game regularly bringing in new content. There is NO NEW CONTENT, they just changing the theme on the app and bringing in new videos. Well, thank you, I think we can watch Peppa for free basically anywhere. And I didn't even mentioned the bugs... My 2 years old daughter gets bored with it real quick.",Zsolt Kaszas,c2ac8591-be25-4548-a3dd-1f06d2ebf0fe,World of Peppa Pig: Kids Games,com.peppapig.worldofpeppapig_g,1,137,1,Praise and Comparisons,Find Your Fun,Educational,Everyone,False
7165,"The app is good once you pay for it. The free version is horrendous as the children get frustrated at locked things. I've had the subscription a while, my daughter enjoys it but it seems impossible to share the subscription via family link so my daughter can't play on her device. Very frustrating. I have emailed the developers but seems this is a known issue and happens regularly for this reason I wouldn't recommend the game to anyone. I'm paying a good amount and known issues are ignored.",Stephanie Cook,1b2450c1-de82-4197-ac2a-ca37dee0d0f4,World of Peppa Pig: Kids Games,com.peppapig.worldofpeppapig_g,2,222,2,Issues Concerns,Find Your Fun,Educational,Everyone,False
7169,"My child loved this game, but it's still on Halloween stuff, and I think it should update more frequently for the high cost. We have been doing the same games for months now. She is getting bored with something that should be updated more.",Sarah Jewell,1da1b82c-4b91-4124-b464-562077f10c70,World of Peppa Pig: Kids Games,com.peppapig.worldofpeppapig_g,2,228,3,Graphics & Gameplay,Find Your Fun,Educational,Everyone,False
7171,"I have had a subscription for my daughter for over two years. Suddenly, it will not play . I uninstalled, reinstalled multiple times. Extremely frustrating. And I can't get any help to fix it🤔🤨😡😟",The George,60e7eb41-2c06-4458-a57e-166c96147def,World of Peppa Pig: Kids Games,com.peppapig.worldofpeppapig_g,1,130,2,Issues Concerns,Find Your Fun,Educational,Everyone,False
7172,Subscription stopped after 2 months after paying for a yearly subscription. Please can some one help as I have a unhappy 4 year old. Its not a cheap yearly subscription would like issue fixed ASAP please. When going on game everything is showing as locked apart from the free games.,Sinnett Family,90617037-9b43-4578-826f-241a9e47e979,World of Peppa Pig: Kids Games,com.peppapig.worldofpeppapig_g,1,113,2,Issues Concerns,Find Your Fun,Educational,Everyone,False
7205,"Subscription has been joke. It automatically renews and its been at least two and a half years, but has only been fully functional for what seems like the first few months. Want to play on another device? Forget it. There's a needless process to make that happen. Not worth the money. Boooo.",Rob,dd5ede18-dd44-4d99-8d62-ed95f4633017,World of Peppa Pig: Kids Games,com.peppapig.worldofpeppapig_g,1,163,0,Payment and Ads,Find Your Fun,Educational,Everyone,False
7209,"Please stop locking the very few games that were originally free. Once a toddler finds something they enjoy and learns how to use it, taking it away is just cruel. And the price to unlock is just ridiculous, and I certainly won't be paying it now that I have seen how many people still have issues accessing games after signing up. I will be deleting the app.",Jasmin Taylor,5b80df41-4c8f-4e97-8b2d-0e0e2dd3929b,World of Peppa Pig: Kids Games,com.peppapig.worldofpeppapig_g,1,138,0,Payment and Ads,Find Your Fun,Educational,Everyone,False
7223,"This game is fantastic for young kids! My 3yo loves it. The app is regularly updated and new games added. It is definitely worth the money for the full game. Love that you can watch episodes and songs too! And the download for offine episodes is very useful when we travel. I had an issue to restore my purchase, and the support team was very helpful and friendly. They responded quickly with clear instructions, and the issue was resolved easily. Best app by far for toddlers! Thank you!",Sandri van Wyk,23b4135d-5965-4575-8777-04b62ef270f7,World of Peppa Pig: Kids Games,com.peppapig.worldofpeppapig_g,5,815,1,Praise and Comparisons,Find Your Fun,Educational,Everyone,False
7236,"Pretty good. Alot of the games are locked and you have to buy so theres just a handful of free games to play with 3 different ability settings , easy medium and hard. Always has buy pop ups . So wouldnt leave the child on it without you incase they purchase off the ads by clicking on them .",Cameron X,1f37eb36-880c-4d63-908c-f40ed9eca744,World of Peppa Pig: Kids Games,com.peppapig.worldofpeppapig_g,4,301,3,Graphics & Gameplay,Find Your Fun,Educational,Everyone,False
7261,"Our experience is very similar to a lot of others - we signed up because our child loves the app. Having paid and trying to add it to our child's device we are asked to sign up again. We have emailed support and it took 2 months for anyone to respond to us with help, help that had come from other parents trouble shooting their own problems. Our latest email has gone unanswered for weeks again and our child gets very frustrated knowing they cannot use the app.",Old Har-Fer,2da06043-b95c-4e42-86a9-d3a5e6a1af95,World of Peppa Pig: Kids Games,com.peppapig.worldofpeppapig_g,1,378,2,Issues Concerns,Find Your Fun,Educational,Everyone,False
7262,"I love this app for my children. Have had a few hiccups, with not being able to put this app and purchase the subscriptions on my children's tablets which is a real bummer because they are toddlers and have to use my tablet in order to play and I have 2 children that like it SO THEY FIGHT. Very inconvenient in that department. Secondly, now, we're experiencing issues with being able to USE the app on our tablets. I try on my phone and it goes through, but on our tablets, it stays frozen ON LOAD.",Carmella Carrillo,561612f8-7bd3-4625-91b8-a5aca4b897bb,World of Peppa Pig: Kids Games,com.peppapig.worldofpeppapig_g,3,129,2,Issues Concerns,Find Your Fun,Educational,Everyone,False
7270,"My daughter loves the app , many different games and coloring options plus videos. She only 2 and can do 12 piece puzzles and matching games now like a pro. I am disappointed because I was over charged for the year subscription (which is really the only way to fully enjoy the app, otherwise you get like 2 puzzles a game and a coloring thing) but over all I see this app teaching my daughter things I couldn't hold her attention with so that's great for me.",Soda Quinn,4c026eda-34ba-486f-85fc-c24a5047dca5,World of Peppa Pig: Kids Games,com.peppapig.worldofpeppapig_g,3,1085,3,Graphics & Gameplay,Find Your Fun,Educational,Everyone,False
7281,"Upon trying to add the subscription to my account, the app freezes and shuts down when i reopen the app, I am unable to access the subscription and it will not let me attempt to resubscribe. My daughter does enjoy this app but would like to access more than just the 2 or 3 free games available. If there is not a way to fix this, I would like to cancel my year long subscription. Dont want an app that doesnt work.",Amber Robinson,2cf00300-b143-40a5-9bd2-340bc77f92bc,World of Peppa Pig: Kids Games,com.peppapig.worldofpeppapig_g,1,490,2,Issues Concerns,Find Your Fun,Educational,Everyone,False
7300,"The app is fine, the content is ok but it suddenly forgets that you have a subscription and it blocks everything, no way to tell the app that you are already subscribed and you have to reinstall it, can't believe they haven't fixed it, it has been over a year since I had this problem the first time, uninstalled it",Javier Torres,e4a80cc0-71c9-4050-966b-88e885a4db0e,World of Peppa Pig: Kids Games,com.peppapig.worldofpeppapig_g,1,121,2,Issues Concerns,Find Your Fun,Educational,Everyone,False
7310,My kid likes it. Problem I have is with how easy it is for my child to set up a subscription. When it loads a message pops up with options to pay for a subscription. My 3 year old started the process! Luckily i caught her in time. Y'all need to change that. Deleted the app because of this problem.,K C,3a672967-c65a-468f-8bd0-7782c1ccc773,World of Peppa Pig: Kids Games,com.peppapig.worldofpeppapig_g,1,130,2,Issues Concerns,Find Your Fun,Educational,Everyone,False
7319,It is amazing app for me i looooooooove so much 😀👍it is cute how do you get the locked ones please tell me it is amazing game five stars amazing app for me thank you for your work.😍♥️💜💙💚🦄 amazing cute cool install it now awwwww thanks so much again .................................... ................................................. ...................... .........................,Holly Blessing,fc74c79d-1c41-4606-a737-afefbf3d03ce,World of Peppa Pig: Kids Games,com.peppapig.worldofpeppapig_g,5,109,1,Praise and Comparisons,Find Your Fun,Educational,Everyone,False
7330,Thank you very much! I love the game very very much! 😆 I seen my cousin playing this so I want to try it out 😁 it's very education and fun learning stuff :),Matthew Jacob Perez,58368dd1-f6ad-4a30-b2c5-e4292f10ecfd,World of Peppa Pig: Kids Games,com.peppapig.worldofpeppapig_g,5,264,1,Praise and Comparisons,Find Your Fun,Educational,Everyone,False
7341,"This is a subscription app. You CANNOT buy *subscriptions* from a Family Payment Plan and you can ONLY use a Family Payment Plan to make purchases from kid accounts. So if you put this app on you're child's device, it will keep asking them to buy -- BUT THERE IS NO WAY TO BUY IT!! I have spoken with Google Play support and they confirmed -- IT IS NOT POSSIBLE TO BUY A SUBSCRIPTION and this app requires a subscription for most of it. This will only work of purchased and used from the PARENT's device/account.",Kaitlyn Hanrahan,00f0f15e-df24-461a-8840-ecf7d205178e,World of Peppa Pig: Kids Games,com.peppapig.worldofpeppapig_g,1,168,0,Payment and Ads,Find Your Fun,Educational,Everyone,False
7346,"The app will not load, even though we have a good internet connection and I've deleted and then reinstall the app more than one, it just says loading at the bottom of the screen and nothing else! Such a shame bought my daughter a tablet for her birthday and was hoping to be able to have this on the tablet for her!! Very disappointed as it works on my phone!!!",Lois Morris,b8d2a70f-a428-42b3-8008-11e10253f666,World of Peppa Pig: Kids Games,com.peppapig.worldofpeppapig_g,1,104,2,Issues Concerns,Find Your Fun,Educational,Everyone,False
7355,"It's a really good game and I'm still a kid you know and......and umm the loading is making me more anger I mean the preparing snorts it's already 💯%But it's still saying""Preparing snorts 100""I really² hate it so much....😡😡😡😡😡just make it offline if you won't I will give you 1 star",Shelsie Tandih,b65519f9-313f-461d-b151-d2e92ac97b71,World of Peppa Pig: Kids Games,com.peppapig.worldofpeppapig_g,2,334,3,Graphics & Gameplay,Find Your Fun,Educational,Everyone,False
7370,"My son loved Letter School & always looked forward to ""playing"" it, especially once he'd gained a little more confidence with tracing the letters. The themes, animations, sounds, it's all so cute & fun! We recently returned to this app to help my son learn cursive & it was just as awesome as I remembered. We purchased it for a one-time $3.99-ish before they went to subscription model. That didn't include cursive so we had to grab a subscription for that & I was shocked at how $$ it is now! ☹️😯",Sarah Decoteau,37856311-c5a9-45d1-b283-6ef513bd0a8f,LetterSchool - Learn to Write,com.letterschool.lite,4,151,1,Praise and Comparisons,Letterschool Enabling Learning,Educational,Everyone,False
7397,"As a former Early Childhood Special Education teacher I am admittedly picky. The animation after tracing is fun, however this felt more like an exercise in frustration tolerance. It often did not work when I pushed on a point and tried to move the the line to the next point. It took me several tries with each letter to get it to actually trace the entire letter. I'm not even going to have my kiddo try this one. I have no room to share the other things that I think could be better!",Jessica Harck Treadway,15c8c965-1d3e-4a23-b9a7-a8b0c7efaed7,LetterSchool - Learn to Write,com.letterschool.lite,2,259,3,Graphics & Gameplay,Letterschool Enabling Learning,Educational,Everyone,False
7415,"This app seemed to be exactly what I was looking for. I did the free trial and planned to spend $45 to buy the annual subscription. However, it isn't Family Library enabled, so I can't even install it on my son's tablet. The ""workaround"" in the FAQs says to log in on the child's device with your own Google account but that doesn't work for me because the entire purpose of this app was for my son to practice letter formation independently at times when I cannot give him my full attention.",Kristen Robinson,41a20cac-0f26-4be9-9e7d-10b38a7ec465,LetterSchool - Learn to Write,com.letterschool.lite,1,108,2,Issues Concerns,Letterschool Enabling Learning,Educational,Everyone,False
7431,I absoultely love this app. It is fun and engaging and helps students to learn their letter sounds and how to form their letters correctly in a fun way. I love that you can choose the handwriting style as well. I recommend this app to many of my students who are struggling with their handwriting.,Rochelle Morais,12a1e9c7-b323-4107-93b9-c84c90d4c2fe,LetterSchool - Learn to Write,com.letterschool.lite,5,255,1,Praise and Comparisons,Letterschool Enabling Learning,Educational,Everyone,False
7439,"The app was unresponsive: clicking on the shapes & letters did nothing except make them wiggle w/ music. Still not sure how you get to practice a letter. At first I thought it was because I hadn't subscribed. I subscribed. Same issue. I unsuscribed. For less than 5 USD one time fee, there are some fantastic letter tracing apps. At this price, the expectation is higher. Basic issues like this are a no no. I'm open to coming back if value can be demonstrated above and beyond the 5 USD apps.",Amoin Kouakou,9bf4502a-f0aa-4b7d-9e1f-0c96ba0da098,LetterSchool - Learn to Write,com.letterschool.lite,1,289,2,Issues Concerns,Letterschool Enabling Learning,Educational,Everyone,False
7464,The app is great but i paid for content and I can not access it without proving im an adult. I'm grateful for the security step but the main screen goes lateral on my phone and it cuts off all the numbers I need to press in order to access the settings or my profile. I can only see the top half of 1 to 5. When I select an activity the screen rotates so when I click on settings the same question appeares but I could see the whole question. Suggestions?,Hale Hafa,34823df4-2b61-4947-bd74-e7468307cbbf,LetterSchool - Learn to Write,com.letterschool.lite,3,144,2,Issues Concerns,Letterschool Enabling Learning,Educational,Everyone,False
7471,"It's a great app, but it will not load to my son's android tablet. It's loaded fine to my iphone. And if it does load to android, it auto orient's the letters upside down opposite from my son. So he can't play it and that's highly frustrating. Reinstalling or restarting it doesn't work so we can't consider purchasing anything. You don't need another email to support. There's enough feedback here about it. Just fix it!",Dorissa S Davis,07f52ae0-9133-48ae-ac1f-d867f17b4b06,LetterSchool - Learn to Write,com.letterschool.lite,3,153,2,Issues Concerns,Letterschool Enabling Learning,Educational,Everyone,False
7483,"I like the app because it has sounds and things to trace like the led lights train track and more and you can do different fonts and write in cursive. But the only problem is their is no other things to do like spell words with long vowels and the stuff that has not came out yet. So yea, that's the only problem.",Pamela Isgro,b4c6406d-eea6-4c3e-a473-a6e8bb1a4725,LetterSchool - Learn to Write,com.letterschool.lite,4,125,3,Graphics & Gameplay,Letterschool Enabling Learning,Educational,Everyone,False
7489,It's an amazing app. My 6 year old has been using and loving it for years. It's one of the reasons he learned his ABC'S at an early age and now he enjoys using it to practice writing them! I'm impressed with how easy it has for him to learn writing his letters and now he's starting to write them in cursive!,Tara Newby Sanders,1262e192-3abc-4465-b24f-99479604489f,LetterSchool - Learn to Write,com.letterschool.lite,5,144,1,Praise and Comparisons,Letterschool Enabling Learning,Educational,Everyone,False
7523,My son is 8 yrs old and has autism and my daughter is 4. They play this game together and love it. I think a stylo pen would be a great recommondation for this app so they can learn to write with a pencil and not there finger. They have learned so much from this app. It can be challenging at times but isnt that the point!. Love it! I wish the Virtual Schools had apps like this.,moni L,321495a5-c907-4df0-a9de-fb61a19d26de,LetterSchool - Learn to Write,com.letterschool.lite,5,159,1,Praise and Comparisons,Letterschool Enabling Learning,Educational,Everyone,False
7545,"Bad my son does exactly what it shows him. You shouldn't make it so hard for the child to draw. He start drawing like it shows him and what ever design is fallowing his finger will bounce back. Seriously, it just leaves him frustrated and he doesn't even want to do it.i don't blame him I was getting annoyed too.",A Google user,ce7d2276-eec4-4c75-912e-982156429bec,LetterSchool - Learn to Write,com.letterschool.lite,1,115,3,Graphics & Gameplay,Letterschool Enabling Learning,Educational,Everyone,False
7549,"Kids love app so we purchased full version. Every time app starts the purchase disappears and it tries to make me buy the full $9.99 version again and again. I contacted support & they haven't been much help yet... The graphics are good, the animation keeps kids involved but if they can't go past E or 5 it gets frustrating for them & thus mom & dad. The sensitivity for tracing letters is very exact, it might be better to have a bit more tolerance based on child's age & skill level?",A Google user,38d6c5da-321c-4b59-9b94-a2ca433721fe,LetterSchool - Learn to Write,com.letterschool.lite,1,578,1,Praise and Comparisons,Letterschool Enabling Learning,Educational,Everyone,False
7567,"Nice app! I see a lot of effort to make it, however I think it could be even better. 1. in the games where you have to find a letter, I would suggest to deduct a star not only if you click wrong letter but also if the right one leaves the screen (missed one). 2. A better rating what is good writing what is not. now with 2 star rating he will get 'good' which to my mind is a bit too good rating. Otherwise, thank you for good app!",A Google user,c73e2214-7fa6-4b13-87c4-04b46d1d34a9,LetterSchool - Learn to Write,com.letterschool.lite,5,163,3,Graphics & Gameplay,Letterschool Enabling Learning,Educational,Everyone,False
7594,I have tried installing this app on my sons tablet 4 times I even bought the full version. Just for the app to not work. Everytime I try to click on an letter it just flips or dosen't react at all. The strange thing is it works fine on my phone just not the tablet. please fix the problem.,A Google user,bceff539-6907-428f-8d25-9b41f06e5e38,LetterSchool - Learn to Write,com.letterschool.lite,1,103,2,Issues Concerns,Letterschool Enabling Learning,Educational,Everyone,False
7596,"This app is one of the better ones out there for android. WHAT I LIKE: * that it offers the font I want * that it provides multiple practices for each letter. * that it makes you stay close to the guidelines. * that there is immediate feedback. * that tne last try is from memory * that the graphics are fun and appealing. WHAT WOULD MAKE IT BETTER: It needs a top line, a base line and a mid-line so that kids can practice proper placelent, tall and short letters, and letters that extend below.",A Google user,f2fa4356-3e25-4df5-a9e6-b94bac9a1672,LetterSchool - Learn to Write,com.letterschool.lite,4,305,1,Praise and Comparisons,Letterschool Enabling Learning,Educational,Everyone,False
7598,"This game could not be better. The guidance, gentle nudges and the animations make the experience truly engaging. My son loves writing letters for 30 minutes at a time. The fact that it includes different styles of letters is impressive. I have my son use a stylus pen so that he can get used to holding a pencil correctly. This is by far the most useful educational app we have. Fantastic job!",A Google user,ccfaa358-3f5b-4e2e-9db2-3e8484de465b,LetterSchool - Learn to Write,com.letterschool.lite,5,324,1,Praise and Comparisons,Letterschool Enabling Learning,Educational,Everyone,False
7604,Paid €7.49 to open the letters only to find the special offer on the next part of the game to unlock all for €9.99. Please refund my payment and i will buy the full access. Also the testing stage there are some questions which dont have the correct answer as an option in the sequence section to choose. Please fix this,A Google user,285ecb8d-412f-4405-a092-4cf9e24d4917,LetterSchool - Learn to Write,com.letterschool.lite,2,118,0,Payment and Ads,Letterschool Enabling Learning,Educational,Everyone,False
7680,Bug fix made it possible to open the app and play. My daughter loves this app. Great practice for school. If she plays often we will purchase the full version. Excellent customer service from the developer! E-mailed me promptly to let me know the problem was fixed. Very impressed!,A Google user,2c7ab6ed-97af-4507-b2c0-6d303e7cd634,LetterSchool - Learn to Write,com.letterschool.lite,5,185,2,Issues Concerns,Letterschool Enabling Learning,Educational,Everyone,False
